{
 "version": 1,
 "generated_at": "2026-10-28",
 "source": "docs/ModernDocs/client-zero/ontology/page-definitions.yaml",
 "pages": [
  {
   "key": "PAGE-system",
   "type": "System",
   "name": {
    "de": "System",
    "en": "System"
   },
   "sections": [
    {
     "id": "description",
     "title": {
      "de": "Beschreibung",
      "en": "Description"
     },
     "render": "text",
     "required": true,
     "field": "description"
    },
    {
     "id": "areas",
     "title": {
      "de": "Software-Bereiche",
      "en": "Software areas"
     },
     "render": "list",
     "required": true,
     "paths": [
      {
       "path": [
        {
         "relation": "part_of",
         "direction": "in",
         "to_type": "BoundedContext"
        }
       ]
      }
     ]
    },
    {
     "id": "capabilities",
     "title": {
      "de": "Fähigkeiten",
      "en": "Capabilities"
     },
     "render": "list",
     "required": false,
     "paths": [
      {
       "path": [
        {
         "relation": "part_of",
         "direction": "in",
         "to_type": "BoundedContext"
        },
        {
         "relation": "realises",
         "direction": "out",
         "to_type": "Capability"
        }
       ]
      }
     ]
    }
   ]
  },
  {
   "key": "PAGE-software-area",
   "type": "BoundedContext",
   "name": {
    "de": "Software-Bereich (L1)",
    "en": "Software area (L1)"
   },
   "sections": [
    {
     "id": "description",
     "title": {
      "de": "Beschreibung",
      "en": "Description"
     },
     "render": "text",
     "required": true,
     "field": "description"
    },
    {
     "id": "capabilities",
     "title": {
      "de": "Realisierte Fähigkeiten",
      "en": "Capabilities realised"
     },
     "render": "list",
     "required": true,
     "paths": [
      {
       "path": [
        {
         "relation": "realises",
         "direction": "out",
         "to_type": "Capability"
        }
       ]
      }
     ]
    },
    {
     "id": "components",
     "title": {
      "de": "Komponenten (L2)",
      "en": "Components (L2)"
     },
     "render": "table",
     "required": true,
     "paths": [
      {
       "path": [
        {
         "relation": "part_of",
         "direction": "in",
         "to_type": "Component"
        }
       ]
      }
     ],
     "columns": [
      "alloy_status",
      "design_pattern"
     ]
    },
    {
     "id": "interactions",
     "title": {
      "de": "Aufrufe zwischen Komponenten",
      "en": "Calls between components"
     },
     "render": "diagram",
     "required": false,
     "paths": [
      {
       "path": [
        {
         "relation": "part_of",
         "direction": "in",
         "to_type": "Component"
        },
        {
         "relation": "calls",
         "direction": "out",
         "to_type": "Component"
        }
       ]
      },
      {
       "path": [
        {
         "relation": "part_of",
         "direction": "in",
         "to_type": "Component"
        },
        {
         "relation": "calls_back",
         "direction": "out",
         "to_type": "Component"
        }
       ]
      }
     ]
    },
    {
     "id": "explanation",
     "title": {
      "de": "Erläuterung",
      "en": "Explanation"
     },
     "render": "list",
     "required": false,
     "paths": [
      {
       "path": [
        {
         "relation": "describes",
         "direction": "in",
         "to_type": "Record"
        }
       ]
      }
     ]
    }
   ]
  },
  {
   "key": "PAGE-component",
   "type": "Component",
   "name": {
    "de": "Komponente (L2)",
    "en": "Component (L2)"
   },
   "sections": [
    {
     "id": "description",
     "title": {
      "de": "Beschreibung",
      "en": "Description"
     },
     "render": "text",
     "required": true,
     "field": "description"
    },
    {
     "id": "capabilities",
     "title": {
      "de": "Realisierte Fähigkeiten",
      "en": "Capabilities realised"
     },
     "render": "list",
     "required": true,
     "paths": [
      {
       "path": [
        {
         "relation": "realises",
         "direction": "out",
         "to_type": "Capability"
        }
       ]
      },
      {
       "path": [
        {
         "relation": "part_of",
         "direction": "out",
         "to_type": "BoundedContext"
        },
        {
         "relation": "realises",
         "direction": "out",
         "to_type": "Capability"
        }
       ],
       "label": "via its software area"
      }
     ]
    },
    {
     "id": "responsibilities",
     "title": {
      "de": "Verantwortlichkeiten",
      "en": "Responsibilities"
     },
     "render": "list",
     "required": true,
     "paths": [
      {
       "path": [
        {
         "relation": "governs",
         "direction": "in",
         "to_type": "ComponentContract"
        }
       ],
       "where": {
        "fact": "kind",
        "equals": "responsibility"
       }
      }
     ]
    },
    {
     "id": "contracts",
     "title": {
      "de": "Vor- und Nachbedingungen",
      "en": "Pre- and postconditions"
     },
     "render": "table",
     "required": true,
     "paths": [
      {
       "path": [
        {
         "relation": "governs",
         "direction": "in",
         "to_type": "ComponentContract"
        }
       ],
       "where": {
        "fact": "kind",
        "in": [
         "precondition",
         "postcondition"
        ]
       }
      }
     ],
     "columns": [
      "kind"
     ]
    },
    {
     "id": "invariants",
     "title": {
      "de": "Goldene Invarianten und ihre Prüfung",
      "en": "Golden invariants and their verification"
     },
     "render": "status-list",
     "required": true,
     "paths": [
      {
       "path": [
        {
         "relation": "keeps",
         "direction": "out",
         "to_type": "Invariant"
        }
       ]
      }
     ],
     "status": {
      "path": [
       {
        "relation": "verifies",
        "direction": "in",
        "to_type": "AlloyCheck"
       }
      ],
      "fact": "outcome",
      "passing": "passed"
     }
    },
    {
     "id": "interfaces",
     "title": {
      "de": "Schnittstellen",
      "en": "Interfaces"
     },
     "render": "table",
     "required": false,
     "paths": [
      {
       "path": [
        {
         "relation": "exposes",
         "direction": "out",
         "to_type": "Interface"
        }
       ]
      },
      {
       "path": [
        {
         "relation": "part_of",
         "direction": "in",
         "to_type": "Component"
        },
        {
         "relation": "exposes",
         "direction": "out",
         "to_type": "Interface"
        }
       ],
       "label": "via its sub-parts"
      }
     ],
     "columns": [
      "methods",
      "path",
      "documented_in"
     ]
    },
    {
     "id": "calls",
     "title": {
      "de": "Ruft auf und wird aufgerufen von",
      "en": "Calls and called by"
     },
     "render": "diagram",
     "required": true,
     "paths": [
      {
       "path": [
        {
         "relation": "calls",
         "direction": "out",
         "to_type": "Component"
        }
       ],
       "label": "calls"
      },
      {
       "path": [
        {
         "relation": "calls_back",
         "direction": "out",
         "to_type": "Component"
        }
       ],
       "label": "calls"
      },
      {
       "path": [
        {
         "relation": "calls",
         "direction": "in",
         "to_type": "Component"
        }
       ],
       "label": "called by"
      },
      {
       "path": [
        {
         "relation": "calls_back",
         "direction": "in",
         "to_type": "Component"
        }
       ],
       "label": "called by"
      },
      {
       "path": [
        {
         "relation": "initiated_by",
         "direction": "in",
         "to_type": "Interaction"
        }
       ],
       "label": "details"
      },
      {
       "path": [
        {
         "relation": "received_by",
         "direction": "in",
         "to_type": "Interaction"
        }
       ],
       "label": "details"
      }
     ]
    },
    {
     "id": "sub_parts",
     "title": {
      "de": "Teilkomponenten (L3)",
      "en": "Sub-parts (L3)"
     },
     "render": "list",
     "required": false,
     "paths": [
      {
       "path": [
        {
         "relation": "part_of",
         "direction": "in",
         "to_type": "Component"
        }
       ]
      }
     ]
    },
    {
     "id": "source_files",
     "title": {
      "de": "Quelldateien",
      "en": "Source files"
     },
     "render": "list",
     "required": true,
     "paths": [
      {
       "path": [
        {
         "relation": "part_of",
         "direction": "in",
         "to_type": "SourceFile"
        }
       ]
      }
     ]
    },
    {
     "id": "commits",
     "title": {
      "de": "Letzte Commits",
      "en": "Recent commits"
     },
     "render": "table",
     "required": false,
     "paths": [
      {
       "path": [
        {
         "relation": "changes",
         "direction": "in",
         "to_type": "Commit"
        }
       ]
      }
     ],
     "columns": [
      "committed_on",
      "author"
     ],
     "order_by": {
      "fact": "committed_on",
      "direction": "desc"
     },
     "limit": 10
    },
    {
     "id": "plans",
     "title": {
      "de": "Offene Feature-Pläne",
      "en": "Open feature plans"
     },
     "render": "status-list",
     "required": false,
     "paths": [
      {
       "path": [
        {
         "relation": "affects",
         "direction": "in",
         "to_type": "FeaturePlan"
        }
       ],
       "where": {
        "fact": "status",
        "not_in": [
         "released",
         "killed"
        ]
       }
      }
     ],
     "columns": [
      "status"
     ]
    },
    {
     "id": "decisions",
     "title": {
      "de": "Entscheidungen",